[
  {
    "assetId": "village_facade_great_lantern",
    "screen": "village",
    "role": "landmark",
    "family": "tono_sato",
    "state": "normal",
    "requiredStates": ["normal", "closed", "crisis"],
    "dimensions": { "width": 512, "height": 512 },
    "alpha": true,
    "crop": { "pc": "centered inside inner 92% x 88%; roof and entrance fully visible", "tablet": "centered inside inner 90%; roof and entrance fully visible", "mobile390": "roof and entrance clear of top 56px, bottom 196px, and right movement reserve", "mobile360": "roof and entrance clear of top 56px, bottom 196px, and right movement reserve" },
    "collision": "visual only; existing L tiles and interaction coordinates remain canonical",
    "source": "assets_src/visual_recovery/generated/ar1/village-great-lantern-hvr1-v1.png",
    "generator": "OpenAI built-in image_gen tool; chroma-key alpha by imagegen remove_chroma_key.py; Sharp 0.35.3 runtime encode; 2026-07-21",
    "modelLicenseChain": "OpenAI built-in image_gen; underlying model identifier not exposed; OpenAI Terms of Use and Service Terms reviewed 2026-07-21; project owner approved public and commercial use 2026-07-21",
    "rightsStatus": "cleared",
    "promptVersion": "HVR-1.0-AR1-v1",
    "reviewStatus": "accepted",
    "reviewer": "independent Codex visual reviewer accepted visual QC 2026-07-21; project owner approved public and commercial use 2026-07-21",
    "rejectReason": null,
    "sourceSha256": "f77a8cb4a1c9887fce5adc7e1b37249bccadd9b9c675b06f7b6ca0bff5466ddf",
    "runtimePath": "public/img/visual-recovery/village/great-lantern-hvr1-v1.webp",
    "runtimeSha256": "7190bc2f0c1e08e9af33a43b447b0fba93ec3054d97ea59c0e7e9a018baed305"
  },
  {
    "assetId": "village_facade_forge_storehouse",
    "screen": "village",
    "role": "facade",
    "family": "tono_sato",
    "state": "normal",
    "requiredStates": ["normal", "closed", "crisis"],
    "dimensions": { "width": 512, "height": 384 },
    "alpha": true,
    "crop": { "pc": "inside inner 92% x 88%; entrance, chimney, and anvil fully visible", "tablet": "inside inner 90%; entrance and chimney fully visible", "mobile390": "entrance clear of top 56px, bottom 196px, and right movement reserve", "mobile360": "entrance clear of top 56px, bottom 196px, and right movement reserve" },
    "collision": "visual only; existing K tiles remain canonical",
    "source": "assets_src/visual_recovery/generated/ar1/village-forge-facade-hvr1-v1.png",
    "generator": "OpenAI built-in image_gen tool; chroma-key alpha by imagegen remove_chroma_key.py; Sharp 0.35.3 runtime encode; 2026-07-21",
    "modelLicenseChain": "OpenAI built-in image_gen; underlying model identifier not exposed; OpenAI Terms of Use and Service Terms reviewed 2026-07-21; project owner approved public and commercial use 2026-07-21",
    "rightsStatus": "cleared",
    "promptVersion": "HVR-1.0-AR1-v1",
    "reviewStatus": "accepted",
    "reviewer": "independent Codex visual reviewer accepted visual QC 2026-07-21; project owner approved public and commercial use 2026-07-21",
    "rejectReason": null,
    "sourceSha256": "c6fa54db411f278722620da81e65e6dc8ed45be3aa7f5abea04da064d04ef973",
    "runtimePath": "public/img/visual-recovery/village/forge-facade-hvr1-v1.webp",
    "runtimeSha256": "aec7444229ace8a2df5fe14be3dbb48b57abf3b51d5f80ae4eb35b411a51e2e6"
  },
  {
    "assetId": "village_facade_star_shrine",
    "screen": "village",
    "role": "facade",
    "family": "tono_sato",
    "state": "normal",
    "requiredStates": ["normal", "closed", "crisis"],
    "dimensions": { "width": 512, "height": 384 },
    "alpha": true,
    "crop": { "pc": "torii and offering light visible", "tablet": "torii visible", "mobile390": "entrance clear of controls", "mobile360": "entrance clear of controls" },
    "collision": "visual only; existing S tiles remain canonical",
    "source": "assets_src/visual_recovery/generated/ar1r/village-star-shrine-hvr1-v1.png",
    "generator": "OpenAI built-in image_gen tool; chroma-key alpha by imagegen remove_chroma_key.py; Sharp 0.35.3 runtime encode; 2026-07-21",
    "modelLicenseChain": "OpenAI built-in image_gen; underlying model identifier not exposed; OpenAI Terms of Use and Service Terms reviewed 2026-07-21; project owner approved public and commercial use 2026-07-21",
    "rightsStatus": "cleared",
    "promptVersion": "HVR-1.0-AR1R-v1",
    "reviewStatus": "accepted",
    "reviewer": "primary Codex visual QC accepted 2026-07-21; project owner approved public and commercial use 2026-07-21",
    "rejectReason": null,
    "sourceSha256": "725825a791f94decea1ee2e9ffb086ca0d8d791bb2861a07562b0baa38876816",
    "runtimePath": "public/img/visual-recovery/village/star-shrine-hvr1-v1.webp",
    "runtimeSha256": "0886411a6e7e4d682ed6d7f18ce266ffbe5c3ad5ab45a5b78810226028b75579"
  },
  {
    "assetId": "village_facade_tofu_shop",
    "screen": "village",
    "role": "facade",
    "family": "tono_sato",
    "state": "normal",
    "requiredStates": ["normal", "closed", "crisis"],
    "dimensions": { "width": 512, "height": 384 },
    "alpha": true,
    "crop": { "pc": "curtain and steam visible", "tablet": "curtain visible", "mobile390": "entrance clear of controls", "mobile360": "entrance clear of controls" },
    "collision": "visual only; existing T tiles remain canonical",
    "source": "assets_src/visual_recovery/generated/ar1r/village-tofu-shop-hvr1-v1.png",
    "generator": "OpenAI built-in image_gen tool; chroma-key alpha by imagegen remove_chroma_key.py; Sharp 0.35.3 runtime encode; 2026-07-21",
    "modelLicenseChain": "OpenAI built-in image_gen; underlying model identifier not exposed; OpenAI Terms of Use and Service Terms reviewed 2026-07-21; project owner approved public and commercial use 2026-07-21",
    "rightsStatus": "cleared",
    "promptVersion": "HVR-1.0-AR1R-v1",
    "reviewStatus": "accepted",
    "reviewer": "primary Codex visual QC accepted 2026-07-21; project owner approved public and commercial use 2026-07-21",
    "rejectReason": null,
    "sourceSha256": "ec82198d221aec87ba79c3bd1dd38893b481757c8c5aa3558f276d7acf669516",
    "runtimePath": "public/img/visual-recovery/village/tofu-shop-hvr1-v1.webp",
    "runtimeSha256": "886d35a47877cf63aecbe9647fe36763e93cb44c86ac76e8883cdc6565103d23"
  },
  {
    "assetId": "village_facade_departure_gate",
    "screen": "village",
    "role": "facade",
    "family": "tono_sato",
    "state": "normal",
    "requiredStates": ["normal", "closed", "crisis"],
    "dimensions": { "width": 512, "height": 384 },
    "alpha": true,
    "crop": { "pc": "both posts and road visible", "tablet": "both posts visible", "mobile390": "gate opening clear of controls", "mobile360": "gate opening clear of controls" },
    "collision": "visual only; existing G tiles remain canonical",
    "source": "assets_src/visual_recovery/generated/ar1r/village-departure-gate-hvr1-v1.png",
    "generator": "OpenAI built-in image_gen tool; chroma-key alpha by imagegen remove_chroma_key.py; Sharp 0.35.3 runtime encode; 2026-07-21",
    "modelLicenseChain": "OpenAI built-in image_gen; underlying model identifier not exposed; OpenAI Terms of Use and Service Terms reviewed 2026-07-21; project owner approved public and commercial use 2026-07-21",
    "rightsStatus": "cleared",
    "promptVersion": "HVR-1.0-AR1R-v1",
    "reviewStatus": "accepted",
    "reviewer": "primary Codex visual QC accepted 2026-07-21; project owner approved public and commercial use 2026-07-21",
    "rejectReason": null,
    "sourceSha256": "1ccce60981c98515f34e3f43d408c08173b105c18c4efa55f322ea470007d883",
    "runtimePath": "public/img/visual-recovery/village/departure-gate-hvr1-v1.webp",
    "runtimeSha256": "8ac4e3410aaa733d8b440fe72bfb1e82944c10c4afd1f6e333c48ac4d97d7e76"
  },
  {
    "assetId": "dungeon_hotarubi_landmark_drowned_shrine_firefly_reed",
    "screen": "dungeon",
    "role": "landmark",
    "family": "hotarubi_hollow",
    "state": "normal",
    "requiredStates": ["normal"],
    "dimensions": { "width": 512, "height": 384 },
    "alpha": true,
    "crop": { "pc": "centered inside inner 92% x 88%; drowned roof, water footprint, and reeds fully visible", "tablet": "centered inside inner 90%; landmark silhouette fully visible", "mobile390": "landmark clear of top 56px, bottom 196px, and right movement reserve", "mobile360": "landmark clear of top 56px, bottom 196px, and right movement reserve" },
    "collision": "visual only; existing dungeon tiles, route graph, and collision remain canonical",
    "source": "assets_src/visual_recovery/generated/ar1/hotarubi-drowned-shrine-firefly-reed-hvr1-v1.png",
    "generator": "OpenAI built-in image_gen tool; chroma-key alpha by imagegen remove_chroma_key.py; Sharp 0.35.3 runtime encode; 2026-07-21",
    "modelLicenseChain": "OpenAI built-in image_gen; underlying model identifier not exposed; OpenAI Terms of Use and Service Terms reviewed 2026-07-21; project owner approved public and commercial use 2026-07-21",
    "rightsStatus": "cleared",
    "promptVersion": "HVR-1.0-AR1-v1",
    "reviewStatus": "accepted",
    "reviewer": "independent Codex visual reviewer accepted visual QC 2026-07-21; project owner approved public and commercial use 2026-07-21",
    "rejectReason": null,
    "sourceSha256": "eacd9d08213485a6c03dee68f3afd9e6e4f5db8fcfbdbac2b6169b8385ce24cb",
    "runtimePath": "public/img/visual-recovery/hotarubi/drowned-shrine-firefly-reed-hvr1-v1.webp",
    "runtimeSha256": "171892dad9eb5be64d52e68e3d558d0b0b6be4ed957d0c0b09cb70803496ebd2"
  },
  {
    "assetId": "dungeon_hotarubi_foreground_root_reed",
    "screen": "dungeon",
    "role": "foreground",
    "family": "hotarubi_hollow",
    "state": "normal",
    "requiredStates": ["normal"],
    "dimensions": { "width": 768, "height": 384 },
    "alpha": true,